{
  "schema_version": "0.1.1",
  "schema_ref": "schemas/domains/news.schema.json",
  "snapshot_id": "news:briefing:2026-08-24",
  "source_id": "news:briefing",
  "domain": "news",
  "source": "briefing",
  "generated_at": "2026-08-24T06:55:00Z",
  "effective_period": {
    "start": "2026-08-23T06:55:00Z",
    "end": "2026-08-24T06:55:00Z",
    "timezone": "UTC"
  },
  "status": "success",
  "producer": {
    "worker_id": "news-briefing-daily",
    "workflow": "example",
    "version": "0.1.1"
  },
  "sources": [
    {
      "label": "Synthetic public reporting",
      "status": "ok",
      "as_of": "2026-08-24T06:45:00Z",
      "reference": "synthetic://news"
    }
  ],
  "freshness": {
    "expires_at": "2026-08-25T06:55:00Z"
  },
  "quality": {
    "confidence": "high",
    "warnings": ["Stories and links in demo mode are illustrative, not current news."]
  },
  "privacy": {
    "classification": "public",
    "contains_personal_data": false,
    "synthetic": true
  },
  "data": {
    "title": "Briefing",
    "summary": "Five developments selected for your interests, with context for what to investigate next. These example stories and links are fictional.",
    "attention": "low",
    "facts": {
      "stories": [
        {
          "id": "n1",
          "title": "Open standards make agent workflows easier to move",
          "summary": "Teams can change models without rebuilding every downstream view.",
          "published_at": "2026-08-24T06:30:00Z",
          "url": "https://example.com/ai-standards",
          "topics": ["AI systems"]
        },
        {
          "id": "n2",
          "title": "Smaller software releases outperform big-bang delivery",
          "summary": "Reliability improves when feedback arrives before architecture hardens.",
          "published_at": "2026-08-24T06:20:00Z",
          "url": "https://example.com/software-delivery",
          "topics": ["Engineering"]
        },
        {
          "id": "n3",
          "title": "Privacy controls move closer to the data layer",
          "summary": "Access boundaries become portable across hosting providers.",
          "published_at": "2026-08-24T06:10:00Z",
          "url": "https://example.com/privacy-controls",
          "topics": ["Privacy"]
        },
        {
          "id": "n4",
          "title": "Local-first tools add portable encrypted exports",
          "summary": "Users can move durable records without giving the application permanent custody of their history.",
          "published_at": "2026-08-24T05:50:00Z",
          "url": "https://example.com/local-first-exports",
          "topics": ["Privacy", "Product design"]
        },
        {
          "id": "n5",
          "title": "Schema registries become a coordination layer for AI workflows",
          "summary": "Teams are separating durable facts from model-specific presentation decisions.",
          "published_at": "2026-08-24T05:40:00Z",
          "url": "https://example.com/schema-registries",
          "topics": ["AI systems", "Engineering"]
        }
      ]
    },
    "presentation": {
      "layout": "dashboard",
      "blocks": [
        {
          "id": "briefing",
          "kind": "list",
          "title": "Selected reading",
          "span": "two",
          "items": [
            {
              "id": "n1",
              "title": "Open standards make agent workflows easier to move",
              "description": "Teams can change models without rebuilding every downstream view.",
              "meta": "AI systems",
              "tone": "neutral",
              "href": "https://example.com/ai-standards"
            },
            {
              "id": "n2",
              "title": "Smaller software releases outperform big-bang delivery",
              "description": "Reliability improves when feedback arrives before architecture hardens.",
              "meta": "Engineering",
              "tone": "neutral",
              "href": "https://example.com/software-delivery"
            },
            {
              "id": "n3",
              "title": "Privacy controls move closer to the data layer",
              "description": "Access boundaries become portable across hosting providers.",
              "meta": "Privacy",
              "tone": "neutral",
              "href": "https://example.com/privacy-controls"
            },
            {
              "id": "n4",
              "title": "Local-first tools add portable encrypted exports",
              "description": "Users can move durable records without giving the application permanent custody of their history.",
              "meta": "Privacy · Product design",
              "tone": "neutral",
              "href": "https://example.com/local-first-exports"
            },
            {
              "id": "n5",
              "title": "Schema registries become a coordination layer for AI workflows",
              "description": "Teams are separating durable facts from model-specific presentation decisions.",
              "meta": "AI systems · Engineering",
              "tone": "neutral",
              "href": "https://example.com/schema-registries"
            }
          ],
          "description": "Short summaries with source links; open a source before acting on a claim."
        },
        {
          "id": "watch",
          "kind": "list",
          "title": "Questions worth checking",
          "span": "one",
          "items": [
            {
              "title": "Can you export your data?",
              "description": "Look for a documented export format before adopting a new tool.",
              "tone": "neutral",
              "id": "question-1",
              "meta": "Portability"
            },
            {
              "title": "Is access private by default?",
              "description": "Check the actual access settings, not only the product description.",
              "tone": "neutral",
              "id": "question-2",
              "meta": "Privacy"
            }
          ]
        }
      ]
    }
  }
}
