{
  "schema_version": "0.1.1",
  "schema_ref": "schemas/domains/agenda.schema.json",
  "snapshot_id": "agenda:primary:2026-08-24",
  "source_id": "agenda:primary",
  "domain": "agenda",
  "source": "primary",
  "generated_at": "2026-08-24T07:20:00Z",
  "effective_period": {
    "start": "2026-08-24T00:00:00Z",
    "end": "2026-08-24T23:59:59Z",
    "timezone": "UTC"
  },
  "status": "success",
  "producer": {
    "worker_id": "agenda-daily",
    "workflow": "example",
    "version": "0.1.1"
  },
  "sources": [
    {
      "label": "Synthetic calendar",
      "status": "ok",
      "as_of": "2026-08-24T07:20:00Z",
      "reference": "synthetic://calendar"
    }
  ],
  "freshness": {
    "expires_at": "2026-08-25T13:20:00Z"
  },
  "quality": {
    "confidence": "high",
    "warnings": []
  },
  "privacy": {
    "classification": "public",
    "contains_personal_data": false,
    "synthetic": true
  },
  "data": {
    "title": "Agenda",
    "summary": "See today\u2019s commitments and prepare for the next one. Two focus windows total 3.5 hours; the only meeting takes 30 minutes.",
    "attention": "low",
    "facts": {
      "events": [
        {
          "id": "a1",
          "title": "Finish the homepage",
          "start": "2026-08-24T08:30:00Z",
          "end": "2026-08-24T10:30:00Z",
          "status": "scheduled"
        },
        {
          "id": "a2",
          "title": "Project check-in",
          "start": "2026-08-24T11:00:00Z",
          "end": "2026-08-24T11:30:00Z",
          "status": "scheduled"
        },
        {
          "id": "a3",
          "title": "Review the homepage",
          "start": "2026-08-24T13:00:00Z",
          "end": "2026-08-24T14:30:00Z",
          "status": "scheduled"
        },
        {
          "id": "a4",
          "title": "Walk and reset",
          "start": "2026-08-24T15:00:00Z",
          "end": "2026-08-24T15:30:00Z",
          "status": "scheduled"
        }
      ],
      "actions": [
        {
          "id": "p1",
          "title": "Open the homepage feedback",
          "due_at": "2026-08-24T08:30:00Z",
          "status": "open"
        },
        {
          "id": "p2",
          "title": "List the decision needed at check-in",
          "due_at": "2026-08-24T11:00:00Z",
          "status": "open"
        },
        {
          "id": "p3",
          "title": "Prepare the review link",
          "due_at": "2026-08-24T13:00:00Z",
          "status": "open"
        }
      ]
    },
    "presentation": {
      "layout": "dashboard",
      "blocks": [
        {
          "id": "day-capacity",
          "kind": "metric-group",
          "title": "Today\u2019s commitments",
          "span": "full",
          "metrics": [
            {
              "label": "Focus time",
              "value": 3.5,
              "unit": "hours"
            },
            {
              "label": "Meeting time",
              "value": 30,
              "unit": "minutes"
            },
            {
              "label": "Scheduled events",
              "value": 4
            }
          ]
        },
        {
          "id": "schedule",
          "kind": "calendar",
          "title": "Monday\u2019s schedule",
          "date": "2026-08-24",
          "span": "two",
          "events": [
            {
              "id": "a1",
              "title": "Finish the homepage",
              "start": "2026-08-24T08:30:00Z",
              "end": "2026-08-24T10:30:00Z",
              "tone": "positive"
            },
            {
              "id": "a2",
              "title": "Project check-in",
              "start": "2026-08-24T11:00:00Z",
              "end": "2026-08-24T11:30:00Z",
              "tone": "info"
            },
            {
              "id": "a3",
              "title": "Review the homepage",
              "start": "2026-08-24T13:00:00Z",
              "end": "2026-08-24T14:30:00Z",
              "tone": "positive"
            },
            {
              "id": "a4",
              "title": "Walk and reset",
              "start": "2026-08-24T15:00:00Z",
              "end": "2026-08-24T15:30:00Z",
              "tone": "neutral"
            }
          ],
          "description": "August 24 \u00b7 all times in UTC"
        },
        {
          "id": "prep",
          "kind": "list",
          "title": "Before each commitment",
          "span": "one",
          "items": [
            {
              "id": "p1",
              "title": "Open the homepage feedback",
              "meta": "Before 08:30",
              "tone": "neutral"
            },
            {
              "id": "p2",
              "title": "List the decision needed at check-in",
              "meta": "Before 11:00",
              "tone": "info"
            },
            {
              "id": "p3",
              "title": "Prepare the review link",
              "meta": "Before 13:00",
              "tone": "neutral"
            }
          ]
        },
        {
          "id": "buffer",
          "kind": "notice",
          "title": "Keep 15:30 onward unclaimed",
          "body": "That window absorbs a late review, travel, or an unfinished release note without displacing recovery time.",
          "tone": "info",
          "span": "full"
        }
      ]
    }
  }
}
