{
  "schema_version": "0.1.1",
  "schema_ref": "schemas/domains/work.schema.json",
  "snapshot_id": "work:focus:2026-08-24",
  "source_id": "work:focus",
  "domain": "work",
  "source": "focus",
  "generated_at": "2026-08-24T07:10:00Z",
  "effective_period": {
    "start": "2026-08-24T00:00:00Z",
    "end": "2026-08-24T23:59:59Z",
    "timezone": "UTC"
  },
  "status": "success",
  "producer": {
    "worker_id": "work-focus-daily",
    "workflow": "example",
    "version": "0.1.1"
  },
  "sources": [
    {
      "label": "Synthetic task tracker",
      "status": "ok",
      "as_of": "2026-08-24T07:10:00Z",
      "reference": "synthetic://tasks"
    }
  ],
  "freshness": {
    "expires_at": "2026-08-25T19:10:00Z"
  },
  "quality": {
    "confidence": "high",
    "warnings": []
  },
  "privacy": {
    "classification": "public",
    "contains_personal_data": false,
    "synthetic": true
  },
  "data": {
    "title": "One finished thing beats five starts.",
    "summary": "Five owned items: one in progress, two ready, one waiting, and one blocked. Finish the renderer before pulling another task into progress.",
    "attention": "medium",
    "facts": {
      "items": [
        {
          "id": "renderer",
          "title": "Adaptive block renderer",
          "status": "in-progress",
          "priority": "high",
          "next_action": "Complete the table component"
        },
        {
          "id": "deployment",
          "title": "Private deployment recipe",
          "status": "ready",
          "priority": "medium",
          "next_action": "Verify the Access checklist"
        },
        {
          "id": "connector",
          "title": "Connector example",
          "status": "blocked",
          "priority": "medium",
          "next_action": "Wait for source permission"
        },
        {
          "id": "fixtures",
          "title": "Renderer fixture coverage",
          "status": "ready",
          "priority": "high",
          "next_action": "Add one valid example per audited block",
          "due_at": "2026-08-25T16:00:00Z"
        },
        {
          "id": "docs",
          "title": "Contract extension guide",
          "status": "waiting",
          "priority": "medium",
          "next_action": "Review after fixtures land"
        }
      ]
    },
    "presentation": {
      "layout": "dashboard",
      "blocks": [
        {
          "id": "work-counts",
          "kind": "metric-group",
          "title": "Current work",
          "span": "full",
          "metrics": [
            {
              "label": "In progress",
              "value": 1,
              "tone": "positive"
            },
            {
              "label": "Ready",
              "value": 2,
              "tone": "info"
            },
            {
              "label": "Blocked",
              "value": 1,
              "tone": "warning"
            },
            {
              "label": "Waiting",
              "value": 1,
              "tone": "neutral"
            }
          ]
        },
        {
          "id": "work-distribution",
          "kind": "donut-chart",
          "title": "Where work stands",
          "description": "All five owned items, grouped by state. Select a state to inspect its count.",
          "span": "two",
          "center_label": "Owned items",
          "value_format": "number",
          "segments": [
            {
              "label": "In progress",
              "value": 1
            },
            {
              "label": "Ready",
              "value": 2
            },
            {
              "label": "Waiting",
              "value": 1
            },
            {
              "label": "Blocked",
              "value": 1
            }
          ]
        },
        {
          "id": "work-next",
          "kind": "list",
          "title": "Best next moves",
          "span": "one",
          "items": [
            {
              "id": "w1",
              "title": "Finish one end-to-end path",
              "description": "Prefer a complete thin slice over three half-started components.",
              "meta": "90 minutes",
              "tone": "positive"
            },
            {
              "id": "w2",
              "title": "Write the open decision",
              "description": "Make the blocker answerable in one message.",
              "meta": "10 minutes",
              "tone": "info"
            }
          ]
        },
        {
          "id": "delivery-progress",
          "kind": "progress",
          "title": "Delivery evidence",
          "span": "one",
          "items": [
            {
              "label": "Complete slice",
              "value": 7,
              "max": 10,
              "value_label": "7 of 10 checks",
              "tone": "positive"
            },
            {
              "label": "Fixture coverage",
              "value": 8,
              "max": 11,
              "value_label": "8 of 11 blocks",
              "tone": "info"
            },
            {
              "label": "Release evidence",
              "value": 3,
              "max": 5,
              "value_label": "3 of 5 gates",
              "tone": "warning"
            }
          ]
        },
        {
          "id": "delivery-sequence",
          "kind": "timeline",
          "title": "Path to done",
          "span": "two",
          "items": [
            {
              "label": "Now",
              "title": "Finish the renderer path",
              "description": "Implementation, fixture, and test move together.",
              "tone": "positive"
            },
            {
              "label": "Next",
              "title": "Run the full contract gate",
              "description": "Fix only evidence-backed failures.",
              "tone": "info"
            },
            {
              "label": "Then",
              "title": "Publish the extension guide",
              "description": "Document the exact safe boundary.",
              "tone": "neutral"
            }
          ]
        },
        {
          "id": "owned-work",
          "kind": "table",
          "title": "Owned work",
          "span": "full",
          "columns": [
            {
              "key": "item",
              "label": "Item"
            },
            {
              "key": "state",
              "label": "State"
            },
            {
              "key": "next",
              "label": "Next action"
            }
          ],
          "rows": [
            {
              "item": "Adaptive block renderer",
              "state": "In progress",
              "next": "Complete the table component"
            },
            {
              "item": "Private deployment recipe",
              "state": "Ready",
              "next": "Verify Access checklist"
            },
            {
              "item": "Connector example",
              "state": "Blocked",
              "next": "Wait for source permission"
            },
            {
              "item": "Renderer fixture coverage",
              "state": "Ready",
              "next": "Add one example per audited block"
            },
            {
              "item": "Contract extension guide",
              "state": "Waiting",
              "next": "Review after fixtures land"
            }
          ]
        },
        {
          "id": "external-blocker",
          "kind": "notice",
          "title": "The connector is not startable",
          "body": "Source permission is outside the current work boundary. Keep it visible, but do not let it interrupt the complete renderer slice.",
          "tone": "warning",
          "span": "full"
        }
      ]
    }
  }
}
