{
  "schema_version": "0.1.1",
  "schema_ref": "schemas/domains/inbox.schema.json",
  "snapshot_id": "inbox:attention:2026-08-24",
  "source_id": "inbox:attention",
  "domain": "inbox",
  "source": "attention",
  "generated_at": "2026-08-24T07:15:00Z",
  "effective_period": {
    "start": "2026-08-23T07:15:00Z",
    "end": "2026-08-24T07:15:00Z",
    "timezone": "UTC"
  },
  "status": "success",
  "producer": {
    "worker_id": "inbox-attention-daily",
    "workflow": "example",
    "version": "0.1.1"
  },
  "sources": [
    {
      "label": "Synthetic inbox",
      "status": "ok",
      "as_of": "2026-08-24T07:15:00Z",
      "reference": "synthetic://inbox"
    }
  ],
  "freshness": {
    "expires_at": "2026-08-25T13:15:00Z"
  },
  "quality": {
    "confidence": "high",
    "warnings": []
  },
  "privacy": {
    "classification": "public",
    "contains_personal_data": false,
    "synthetic": true
  },
  "data": {
    "title": "Inbox",
    "summary": "Three messages need your response, including two due today. One conversation is waiting on someone else.",
    "attention": "medium",
    "facts": {
      "items": [
        {
          "id": "m1",
          "sender_label": "Project collaborator",
          "subject_summary": "Choose a planning window",
          "reason": "decision",
          "deadline": "2026-08-24T17:00:00Z",
          "status": "open"
        },
        {
          "id": "m2",
          "sender_label": "Review partner",
          "subject_summary": "Approve the revised outline",
          "reason": "reply",
          "status": "open"
        },
        {
          "id": "m3",
          "sender_label": "Operations contact",
          "subject_summary": "Confirm the renewal choice",
          "reason": "deadline",
          "deadline": "2026-08-24T15:00:00Z",
          "status": "open"
        },
        {
          "id": "m4",
          "sender_label": "Research collaborator",
          "subject_summary": "Close the open question",
          "reason": "follow-up",
          "status": "waiting"
        }
      ]
    },
    "presentation": {
      "layout": "dashboard",
      "blocks": [
        {
          "id": "counts",
          "kind": "metric-group",
          "title": "Message status",
          "span": "full",
          "metrics": [
            {
              "label": "Needs your response",
              "value": 3
            },
            {
              "label": "Due today",
              "value": 2
            },
            {
              "label": "Waiting on others",
              "value": 1
            }
          ]
        },
        {
          "id": "messages",
          "kind": "list",
          "title": "Needs your response",
          "span": "two",
          "items": [
            {
              "id": "m3",
              "title": "Confirm the renewal choice",
              "description": "A yes-or-no choice is due before the afternoon processing window.",
              "meta": "Operations contact \u00b7 Due today, 15:00 UTC",
              "status": "Deadline",
              "tone": "danger"
            },
            {
              "id": "m1",
              "title": "Choose a planning window",
              "description": "A collaborator proposed two times for tomorrow.",
              "meta": "Project collaborator \u00b7 Due today, 17:00 UTC",
              "status": "Decision",
              "tone": "warning"
            },
            {
              "id": "m2",
              "title": "Approve the revised outline",
              "description": "The requested changes are ready for a quick review.",
              "meta": "Review partner \u00b7 No stated deadline",
              "status": "Review",
              "tone": "info"
            }
          ]
        },
        {
          "id": "waiting",
          "kind": "list",
          "title": "Waiting on a response",
          "span": "one",
          "description": "No reply needed from you right now.",
          "items": [
            {
              "id": "m4",
              "title": "Research question",
              "description": "The collaborator has the question. Follow up if it is still unresolved at your next review.",
              "meta": "Research collaborator \u00b7 No deadline",
              "status": "Waiting",
              "tone": "neutral"
            }
          ]
        }
      ]
    }
  }
}
