{
  "schema_version": "0.1.1",
  "schema_ref": "schemas/domains/review.schema.json",
  "snapshot_id": "review:weekly:2026-08-24",
  "source_id": "review:weekly",
  "domain": "review",
  "source": "weekly",
  "generated_at": "2026-08-24T07:40:00Z",
  "effective_period": {
    "start": "2026-08-17T00:00:00Z",
    "end": "2026-08-24T07:40:00Z",
    "timezone": "UTC"
  },
  "status": "partial",
  "producer": {
    "worker_id": "review-weekly",
    "workflow": "example",
    "version": "0.1.1"
  },
  "sources": [
    {
      "label": "Synthetic daily overviews",
      "status": "ok",
      "as_of": "2026-08-24T07:35:00Z",
      "reference": "overview:daily:2026-08-24"
    },
    {
      "label": "Synthetic agenda",
      "status": "ok",
      "as_of": "2026-08-24T07:20:00Z",
      "reference": "agenda:primary:2026-08-24"
    },
    {
      "label": "Synthetic inbox",
      "status": "ok",
      "as_of": "2026-08-24T07:15:00Z",
      "reference": "inbox:attention:2026-08-24"
    },
    {
      "label": "Synthetic work",
      "status": "ok",
      "as_of": "2026-08-24T07:10:00Z",
      "reference": "work:focus:2026-08-24"
    },
    {
      "label": "Synthetic money pulse",
      "status": "stale",
      "as_of": "2026-08-23T18:00:00Z",
      "reference": "money:pulse:2026-08-24"
    },
    {
      "label": "Synthetic news",
      "status": "ok",
      "as_of": "2026-08-24T06:55:00Z",
      "reference": "news:briefing:2026-08-24"
    }
  ],
  "freshness": {
    "expires_at": "2026-09-01T07:40:00Z",
    "next_expected_at": "2026-08-31T07:40:00Z"
  },
  "quality": {
    "confidence": "medium",
    "warnings": ["One input was stale, so money-related conclusions are intentionally limited."]
  },
  "privacy": {
    "classification": "public",
    "contains_personal_data": false,
    "synthetic": true
  },
  "data": {
    "title": "Weekly review",
    "summary": "Review August 17–23 before planning the next week. You recorded 18 focus blocks and 19 interruptions. Thursday had the most focus blocks; this alone does not establish what caused the difference.",
    "attention": "low",
    "facts": {
      "outcomes": [
        {
          "id": "focus-count",
          "label": "18 focus blocks and 19 interruptions recorded across seven days",
          "status": "neutral",
          "evidence_snapshot_ids": ["overview:daily:2026-08-24"]
        },
        {
          "id": "money-limited",
          "label": "Daily financial returns cannot be confirmed from stale prices",
          "status": "unknown",
          "evidence_snapshot_ids": ["money:pulse:2026-08-24"]
        }
      ],
      "patterns": [
        {
          "id": "variation",
          "label": "Daily focus varied from one to four blocks; no causal conclusion is supported",
          "status": "neutral",
          "evidence_snapshot_ids": ["overview:daily:2026-08-24"]
        }
      ],
      "next_actions": [
        {
          "id": "repeat-boundary",
          "label": "Keep the first two hours meeting-free on three weekdays",
          "status": "neutral",
          "evidence_snapshot_ids": ["review:weekly:2026-08-24"]
        },
        {
          "id": "two-reply-windows",
          "label": "Try two reply windows, adjusted around explicit deadlines",
          "status": "neutral",
          "evidence_snapshot_ids": ["inbox:attention:2026-08-24", "overview:daily:2026-08-24"]
        }
      ]
    },
    "presentation": {
      "layout": "dashboard",
      "blocks": [
        {
          "id": "week-metrics",
          "kind": "metric-group",
          "title": "Week totals",
          "span": "full",
          "metrics": [
            {
              "label": "Focus blocks",
              "value": 18
            },
            {
              "label": "Interruptions",
              "value": 19
            },
            {
              "label": "Days recorded",
              "value": 7
            }
          ]
        },
        {
          "id": "focus-trend",
          "kind": "line-chart",
          "title": "Focus through the week",
          "description": "Daily recorded counts, August 17–23. Focus blocks and interruptions are different measures, not hours.",
          "span": "two",
          "series": [
            {
              "key": "focus",
              "label": "Focus blocks"
            },
            {
              "key": "interruptions",
              "label": "Interruptions"
            }
          ],
          "points": [
            {
              "x": "Mon",
              "values": {
                "focus": 2,
                "interruptions": 5
              }
            },
            {
              "x": "Tue",
              "values": {
                "focus": 3,
                "interruptions": 4
              }
            },
            {
              "x": "Wed",
              "values": {
                "focus": 3,
                "interruptions": 3
              }
            },
            {
              "x": "Thu",
              "values": {
                "focus": 4,
                "interruptions": 2
              }
            },
            {
              "x": "Fri",
              "values": {
                "focus": 3,
                "interruptions": 3
              }
            },
            {
              "x": "Sat",
              "values": {
                "focus": 1,
                "interruptions": 1
              }
            },
            {
              "x": "Sun",
              "values": {
                "focus": 2,
                "interruptions": 1
              }
            }
          ]
        },
        {
          "id": "next-week-actions",
          "kind": "list",
          "title": "Try next week",
          "span": "one",
          "items": [
            {
              "id": "n1",
              "title": "Reserve Monday, Wednesday, and Friday mornings",
              "description": "Try keeping two hours free on three mornings, then compare next week’s recorded focus.",
              "status": "Calendar",
              "tone": "positive"
            },
            {
              "id": "n2",
              "title": "Set two inbox windows",
              "description": "Use two bounded reply windows, moving one earlier whenever a message has an explicit deadline. Today’s renewal answer is due at 15:00 UTC.",
              "status": "Boundary",
              "tone": "info"
            }
          ]
        },
        {
          "id": "review-evidence",
          "kind": "table",
          "title": "What this review can establish",
          "span": "full",
          "columns": [
            {
              "key": "measure",
              "label": "Evidence"
            },
            {
              "key": "finding",
              "label": "Finding"
            },
            {
              "key": "limit",
              "label": "Limit"
            }
          ],
          "rows": [
            {
              "measure": "Seven daily observations",
              "finding": "18 focus blocks; 19 interruptions",
              "limit": "Counts do not measure output quality or explain causes"
            },
            {
              "measure": "Latest money snapshot",
              "finding": "One price source is stale",
              "limit": "No verified weekly return"
            },
            {
              "measure": "Current work queue",
              "finding": "One item in progress",
              "limit": "No complete shipment history for the week"
            }
          ]
        }
      ]
    }
  }
}
